{
  "id": "2026-proc-002",
  "clik_docid": null,
  "title": "회기 결정의 건(제336회)",
  "bill_no": null,
  "type": "기타(절차)",
  "proposer": {
    "type": "의장",
    "raw": "의장 제의"
  },
  "outline": "",
  "timeline": [
    {
      "stage": "의결",
      "date": "2026-07-14",
      "result": "가결(회기 2026-07-14~07-28, 15일간)"
    }
  ],
  "votes": {
    "recorded": false,
    "records": []
  },
  "related_members": [],
  "related_dept": null,
  "related_meetings": [
    "2026-plenary-002"
  ],
  "region_tags": [],
  "files": [],
  "_meta": {
    "source_url": "https://council.shinan.go.kr/mnts/asvr/cnts/mnt/mntViewer.php?params=QktKaEt3SVROeFc5ck42RTVQZnMrQT09",
    "source_system": "MANUAL",
    "snapshot_path": "snapshots/신안군의회 회의록20260714_.pdf",
    "source_alive": true,
    "collected_at": "2026-07-17",
    "reviewed_by": "장경수",
    "reviewed_at": "2026-07-18"
  }
}
