{
  "id": "2026-proc-007",
  "clik_docid": null,
  "title": "제336회 임시회 의사일정 협의의 건",
  "bill_no": null,
  "type": "기타(절차)",
  "proposer": {
    "type": "위원장",
    "raw": "의회운영위원장"
  },
  "outline": "",
  "timeline": [
    {
      "stage": "협의",
      "date": "2026-07-09"
    }
  ],
  "votes": {
    "recorded": false,
    "records": []
  },
  "related_members": [],
  "related_dept": null,
  "related_meetings": [
    "2026-steering-002"
  ],
  "region_tags": [],
  "files": [],
  "_meta": {
    "source_url": "https://council.shinan.go.kr",
    "source_system": "MANUAL",
    "snapshot_path": "snapshots/신안군의회 회의록20260709_.pdf",
    "source_alive": true,
    "collected_at": "2026-07-17",
    "reviewed_by": "장경수",
    "reviewed_at": "2026-07-18"
  }
}
