{
  "id": "sample-bill-002",
  "clik_docid": null,
  "title": "[샘플] 신안군 도서지역 응급의료 지원 조례안",
  "bill_no": "제10-2호",
  "type": "조례",
  "proposer": { "type": "집행부", "raw": "신안군수" },
  "outline": "이 조례는 도서지역 주민의 응급의료 접근성을 높이기 위한 이송 지원 등에 관한 사항을 규정한다.",
  "timeline": [
    { "stage": "제안", "date": "2026-08-05" },
    { "stage": "위원회 심사", "date": "2026-08-21", "result": "계속심사" }
  ],
  "votes": { "recorded": false, "records": [] },
  "related_members": ["member-9002"],
  "related_dept": "보건소",
  "related_meetings": [],
  "region_tags": ["흑산면", "하의면"],
  "files": [],
  "_meta": {
    "source_url": "https://council.shinan.go.kr/sample/bill/2",
    "source_system": "MANUAL",
    "snapshot_path": null,
    "source_alive": true,
    "collected_at": "2026-07-03",
    "reviewed_by": "SAMPLE-검수전",
    "reviewed_at": null
  }
}
