{
  "id": "2026-proc-004",
  "clik_docid": null,
  "title": "예산결산특별위원회 구성의 건",
  "bill_no": null,
  "type": "기타(절차)",
  "proposer": {
    "type": "의장",
    "raw": "의장 제의"
  },
  "outline": "",
  "timeline": [
    {
      "stage": "의결",
      "date": "2026-07-14",
      "result": "가결(위원 8인 구성)"
    }
  ],
  "votes": {
    "recorded": false,
    "records": []
  },
  "related_members": [
    "member-0002",
    "member-0003",
    "member-0004",
    "member-0005",
    "member-0006",
    "member-0007",
    "member-0008",
    "member-0009"
  ],
  "related_dept": null,
  "related_meetings": [
    "2026-plenary-002"
  ],
  "region_tags": [],
  "files": [],
  "_meta": {
    "source_url": "https://council.shinan.go.kr/mnts/asvr/cnts/mnt/mntViewer.php?params=QktKaEt3SVROeFc5ck42RTVQZnMrQT09",
    "source_system": "MANUAL",
    "snapshot_path": "snapshots/신안군의회 회의록20260714_.pdf",
    "source_alive": true,
    "collected_at": "2026-07-17",
    "reviewed_by": "장경수",
    "reviewed_at": "2026-07-18"
  }
}
