{
  "id": "2026-bill-003",
  "clik_docid": null,
  "title": "주민조례청구 각하 심의안 (「민간 발전소, 송·변전 설비 운영 및 건설에 관한 조례」 제정 청구)",
  "bill_no": null,
  "type": "조례",
  "proposer": {
    "type": "의장",
    "raw": "의장 제의"
  },
  "outline": "「주민조례발안에 관한 법률」 제12조·「신안군의회 회의규칙」 제72조의3에 따라 주민조례청구 수리 또는 각하 여부를 심의. 청구 접수일은 2026년 1월 9일. 유효 서명 요건은 청구권자 총수 × 1/20 = 1,921명(2026년 기준, 「주민조례발안에 관한 법률」 제5조 및 「신안군 주민조례발안에 관한 조례」). 청구대표자가 제출한 청구인명부 2,141명 중 유효 695명·무효 1,446명으로 확인되었으며, 10일 보정기간 후 보정 미제출로 요건을 충족하지 못하여 각하.",
  "timeline": [
    {
      "stage": "상정",
      "date": "2026-07-08"
    },
    {
      "stage": "의결",
      "date": "2026-07-08",
      "result": "원안가결(각하)"
    }
  ],
  "votes": {
    "recorded": false,
    "records": []
  },
  "related_members": [],
  "related_dept": null,
  "related_meetings": [
    "2026-steering-001"
  ],
  "region_tags": [],
  "files": [],
  "_meta": {
    "source_url": "https://council.shinan.go.kr",
    "source_system": "MANUAL",
    "snapshot_path": "snapshots/신안군의회 회의록20260708_.pdf",
    "source_alive": true,
    "collected_at": "2026-07-18",
    "reviewed_by": "장경수",
    "reviewed_at": "2026-07-18"
  }
}
