{
  "id": "2026-bill-005",
  "clik_docid": null,
  "title": "농어촌 기본소득 지방정부협의회 설립 보고의 건",
  "bill_no": null,
  "type": "보고",
  "proposer": {
    "type": "집행부",
    "raw": "신안군수"
  },
  "outline": "",
  "timeline": [
    {
      "stage": "상임위 회부",
      "date": "2026-07-14"
    }
  ],
  "votes": {
    "recorded": false,
    "records": []
  },
  "related_members": [],
  "related_dept": null,
  "related_meetings": [
    "2026-plenary-002"
  ],
  "region_tags": [],
  "files": [],
  "_meta": {
    "source_url": "https://council.shinan.go.kr/mnts/asvr/cnts/mnt/mntViewer.php?params=QktKaEt3SVROeFc5ck42RTVQZnMrQT09",
    "source_system": "MANUAL",
    "snapshot_path": "snapshots/신안군의회 회의록20260714_.pdf",
    "source_alive": true,
    "collected_at": "2026-07-17",
    "reviewed_by": "장경수",
    "reviewed_at": "2026-07-18"
  }
}
